preprocessed_text,tagged_text
use a 2 phillips screwdriver to remove the four screw .,"2 phillips screwdriver/TOOL, remove/ACTIVITY, four/CARDINALITY, screw/ITEM, "
remove the rubber gasket from the rain tray .,"remove/ACTIVITY, rubber gasket/ITEM, rain tray/ITEM, "
lift the tray upwards and away from the vehicle .,"lift/ACTIVITY, tray/ITEM, upwards/NOISE, away from the vehicle/LOCATION, "
use a flathead screwdriver to remove the cap from the windshield wiper .,"flathead screwdriver/TOOL, remove/ACTIVITY, cap/ITEM, windshield wiper/ITEM, "
use a socket wrench to release the passenger-side windshield wiper locking nut .,"socket wrench/TOOL, release/ACTIVITY, passenger-side/LOCATION, windshield wiper locking nut/ITEM, "
gently lift up the passenger-side windshield wiper .,"gently/NOISE, lift/ACTIVITY, passenger-side/LOCATION, windshield wiper/ITEM, "
remove the driver-side windshield wiper in the same fashion .,"remove/ACTIVITY, driver-side/LOCATION, windshield wiper/ITEM, in the same fashion/NOISE, "
lift up the plastic cover .,"lift/ACTIVITY, plastic cover/ITEM, "
use an offset phillips screwdriver to remove a screw in the back of the automatic control unit cover .,"offset phillips screwdriver/TOOL, remove/ACTIVITY, a/CARDINALITY, screw/ITEM, back of the automatic control unit cover/LOCATION, "
"in a pinch , you can make this tool with a phillips driver bit and end wrench .","make/ACTIVITY, tool/ITEM, phillips driver bit/TOOL, end wrench/TOOL, "
use a 2 phillips screwdriver to remove the front two screw .,"2 phillips screwdriver/TOOL, remove/ACTIVITY, front/LOCATION, two/CARDINALITY, screw/ITEM, "
gently unplug and lift out the automatic transmission control unit .,"gently/NOISE, unplug/ACTIVITY, lift/ACTIVITY, automatic transmission control unit/ITEM, "
remove the plastic phillips screw towards the front of the door panel .,"remove/ACTIVITY, plastic phillips screw/ITEM, front of the door panel/LOCATION, "
"this screw is part of a two-piece securing mechanism . do not apply force directly onto the screw head , because it will continue to slip into the plastic clip .","screw/ITEM, two-piece securing mechanism/OBSERVATION, do not apply force directly onto the screw head/NOISE, slip into the plastic clip/OBSERVATION, "
use a flathead screwdriver to remove the plastic clip that hold the screw .,"flathead screwdriver/TOOL, remove/ACTIVITY, plastic clip/ITEM, hold/OBSERVATION, screw/ITEM, "
unscrew the phillips screw in the bottom of the door panel cup .,"unscrew/ACTIVITY, phillips screw/ITEM, bottom of the door panel cup/LOCATION, "
lift the cup out of the the door panel .,"lift/ACTIVITY, cup/ITEM, door panel/ITEM, "
insert a very thin flathead screwdriver blade into the small gap towards the rear of the car on the plastic screw cover near the door handle .,"insert/ACTIVITY, thin flathead screwdriver blade/TOOL, small gap/LOCATION, rear of the car/LOCATION, plastic screw cover/ITEM, door handle/ITEM, "
unscrew the phillips screw underneath the screw cover .,"unscrew/ACTIVITY, phillips screw/ITEM, underneath the screw cover/LOCATION, "
remove the plastic cover at the base of the c-pillar by pulling it directly away from the window .,"remove/ACTIVITY, plastic cover/ITEM, base of the c-pillar/LOCATION, pulling/ACTIVITY, directly away from the window/LOCATION, "
"the cover is held in place by a metal clip , so some force will be required to free it .","cover/ITEM, held in place/OBSERVATION, metal clip/ITEM, force/ACTIVITY, required/OBSERVATION, free/ACTIVITY, "
"in addition to the metal clip , two small tab at the bottom of the cover keep it in place . gently lift the corner of the door panel to remove the tab from their respective hole in the door .","metal clip/ITEM, two small tab/ITEM, bottom of the cover/LOCATION, gently lift/ACTIVITY, corner of the door panel/LOCATION, remove/ACTIVITY, tab/ITEM, their respective hole in the door/LOCATION, "
"using firm pressure , pull the door panel away from the door . start at the top right , and work down the side , across the bottom , and up the opposite side .","using firm pressure/NOISE, pull/ACTIVITY, door panel/ITEM, away from the door/LOCATION, start at the top right/LOCATION, work down the side/LOCATION, across the bottom/LOCATION, up the opposite side/LOCATION, "
multiple clip hold the door panel in place . the door panel will jerk a each clip is freed from it position .,"multiple clip/ITEM, hold/ACTIVITY, door panel/ITEM, jerk/OBSERVATION, clip/ITEM, freed/OBSERVATION, position/LOCATION, "
"pull the bottom of the door panel away from the door , and lift the entire panel off the door .","pull/ACTIVITY, bottom of the door panel/LOCATION, away from the door/LOCATION, lift/ACTIVITY, entire panel/ITEM, off the door/LOCATION, "
"do not try to completely remove the door panel yet , a it is still attached by a number of electrical connector .","do not try to completely remove the door panel yet/NOISE, attached/OBSERVATION, electrical connector/ITEM, number/CARDINALITY, "
push down on the small tab and pull the connector directly away from it socket to disconnect the power lock switch .,"push down/ACTIVITY, small tab/ITEM, pull/ACTIVITY, connector/ITEM, away from it socket/LOCATION, disconnect/ACTIVITY, power lock switch/ITEM, "
use the same method described above to remove the connector for the tweeter .,"remove/ACTIVITY, connector/ITEM, tweeter/ITEM, "
press the tab on the bottom of the larger green connector to disconnect the side-view mirror control .,"press/ACTIVITY, tab/ITEM, bottom/LOCATION, larger green connector/ITEM, disconnect/ACTIVITY, side-view mirror control/ITEM, "
disconnect the power window connector .,"disconnect/ACTIVITY, power window connector/ITEM, "
you may now remove the entire door panel .,"remove/ACTIVITY, entire door panel/ITEM, "
use compressed air to clear any debris from the area around the ignition coil on top of the engine .,"use/ACTIVITY, compressed air/TOOL, clear/ACTIVITY, debris/ITEM, area around the ignition coil/LOCATION, top of the engine/LOCATION, "
remove the ignition coil electrical connector by first depressing the plastic tab on top of the connector .,"remove/ACTIVITY, ignition coil electrical connector/ITEM, depressing/ACTIVITY, plastic tab/ITEM, top of the connector/LOCATION, "
pull the connector straight away from the ignition coil to detach it .,"pull/ACTIVITY, connector/ITEM, straight away from the ignition coil/LOCATION, detach/ACTIVITY, "
repeat this procedure for the remaining three ignition coil .,"repeat this procedure/ACTIVITY, remaining three/CARDINALITY, ignition coil/ITEM, "
use an 8 mm deep socket to loosen the four ignition coil mounting bolt .,"8 mm deep socket/TOOL, loosen/ACTIVITY, four/CARDINALITY, ignition coil/ITEM, mounting bolt/ITEM, "
"once the bolt are loose , they can be removed by hand .","bolt/ITEM, loose/OBSERVATION, remove/ACTIVITY, by hand/NOISE, "
twist the ignition coil and spark plug boot while lifting it straight up to remove it from the engine .,"twist/ACTIVITY, ignition coil/ITEM, spark plug boot/ITEM, lifting/ACTIVITY, remove/ACTIVITY, engine/ITEM, "
"avoid rocking the coil and boot side-to-side , since this could break the existing spark plug .","avoid rocking/ACTIVITY, coil/ITEM, boot/ITEM, side-to-side/NOISE, break/OBSERVATION, existing spark plug/ITEM, "
use a ratcheting socket wrench with an extender and a 5  or 8 spark plug socket to remove the existing spark plug from the cylinder head . make sure that the spark plug is completely seated in the rubber end of the socket before loosening it .,"ratcheting socket wrench/TOOL, extender/TOOL, 5 or 8 spark plug socket/TOOL, remove/ACTIVITY, existing spark plug/ITEM, cylinder head/ITEM, make sure/ACTIVITY, completely seated/OBSERVATION, rubber end/ITEM, loosening/ACTIVITY, "
apply dielectric grease to the ribbed portion of the insulator .,"apply/ACTIVITY, dielectric grease/MATERIAL, ribbed portion/ITEM, insulator/ITEM, "
gently place the spark plug boot over the rib and twist the two piece back and forth to even out the layer of dielectric grease .,"gently/NOISE, place/ACTIVITY, spark plug boot/ITEM, rib/ITEM, twist/ACTIVITY, two piece/ITEM, even out/ACTIVITY, layer/ITEM, dielectric grease/MATERIAL, "
place the new spark plug firmly in the spark plug socket so that the threaded end stick out .,"place/ACTIVITY, new spark plug/ITEM, spark plug socket/ITEM, firmly/NOISE, threaded end/OBSERVATION, stick out/OBSERVATION, "
apply an even layer of anti-seize compound to the thread of the spark plug .,"apply/ACTIVITY, even layer/OBSERVATION, anti-seize compound/MATERIAL, thread/ITEM, spark plug/ITEM, "
place the new spark plug into the cylinder head and tighten it by hand a much a you can .,"place/ACTIVITY, new spark plug/ITEM, cylinder head/ITEM, tighten/ACTIVITY, by hand/NOISE, as much as you can/NOISE, "
tighten the spark plug to 11 ft-lbs with a torque wrench .,"tighten/ACTIVITY, spark plug/ITEM, 11 ft-lbs/OBSERVATION, torque wrench/TOOL, "
place the ignition coil and dust boot back over the spark plug by pushing down and twisting it into place .,"place/ACTIVITY, ignition coil/ITEM, dust boot/ITEM, back over the spark plug/LOCATION, pushing down/ACTIVITY, twisting/ACTIVITY, into place/LOCATION, "
reconnect the ignition coil electrical connector by snapping it back into place .,"reconnect/ACTIVITY, ignition coil/ITEM, electrical connector/ITEM, snapping it back into place/ACTIVITY, "
pull the hood release latch at the front right of the tractor and lift the hood up .,"pull/ACTIVITY, hood release latch/ITEM, front right/LOCATION, lift/ACTIVITY, hood/ITEM, "
lift the hood prop bar from it seat and place it in the hook on the underside of the hood .,"lift/ACTIVITY, hood prop bar/ITEM, from it seat/LOCATION, place/ACTIVITY, hook/ITEM, underside of the hood/LOCATION, "
pull each tab straight away from the panel and twist them 90 so that they fit through the slot in the panel .,"pull/ACTIVITY, each tab/ITEM, straight away from the panel/LOCATION, twist/ACTIVITY, 90/OBSERVATION, fit through the slot in the panel/LOCATION, "
pull the top of the engine panel straight out until it is free from the tab .,"pull/ACTIVITY, top of the engine panel/ITEM, straight out/LOCATION, free from the tab/OBSERVATION, "
lift the engine panel up to remove it and set it aside .,"lift/ACTIVITY, engine panel/ITEM, remove/ACTIVITY, set it aside/LOCATION, "
the drain plug is a 17 mm hex bolt located on the underside of the tractor .,"drain plug/ITEM, 17 mm hex bolt/ITEM, located/OBSERVATION, underside of the tractor/LOCATION, "
place an oil drain pan underneath the drain plug to catch the oil when it begin to drain .,"place/ACTIVITY, oil drain pan/ITEM, underneath the drain plug/LOCATION, catch/ACTIVITY, oil/MATERIAL, begin to drain/OBSERVATION, "
use a 17 mm box end wrench to loosen the drain plug 3  or 4 of a turn .,"17 mm box end wrench/TOOL, loosen/ACTIVITY, drain plug/ITEM, 3 or 4 of a turn/OBSERVATION, "
loosen the drain plug by hand until it come out and oil begin to drain from the oil pan .,"loosen/ACTIVITY, drain plug/ITEM, by hand/NOISE, come out/OBSERVATION, oil/MATERIAL, begin to drain/OBSERVATION, oil pan/ITEM, "
"while the oil is draining , wipe off the drain plug with a clean rag or towel .","oil/MATERIAL, draining/ACTIVITY, wipe off/ACTIVITY, drain plug/ITEM, clean rag/MATERIAL, towel/MATERIAL, "
"remove the old drain plug gasket and replace it , making sure that the new gasket fit over the thread of the drain plug .","remove/ACTIVITY, old drain plug gasket/ITEM, replace/ACTIVITY, new gasket/ITEM, fit over the thread/OBSERVATION, drain plug/ITEM, "
wipe down the area around the drain plug with a clean rag or towel .,"wipe down/ACTIVITY, area around the drain plug/LOCATION, clean rag/MATERIAL, towel/MATERIAL, "
reinstall the drain plug and tighten it a much a you can by hand .,"reinstall/ACTIVITY, drain plug/ITEM, tighten/ACTIVITY, by hand/NOISE, "
use a 17 mm box end wrench to tighten the drain plug until it is snug .,"17 mm box end wrench/TOOL, tighten/ACTIVITY, drain plug/ITEM, snug/OBSERVATION, "
do not over-tighten the drain plug . doing so may strip the thread or crack the oil pan . you can always come back later and tighten the drain plug more if needed .,"over-tighten/ACTIVITY, drain plug/ITEM, strip/OBSERVATION, thread/ITEM, crack/OBSERVATION, oil pan/ITEM, come back later/NOISE, tighten/ACTIVITY, "
move the oil drain pan so that it is directly under the oil filter .,"move/ACTIVITY, oil drain pan/ITEM, directly under the oil filter/LOCATION, "
remove the oil filter by turning it counterclockwise until it come free .,"remove/ACTIVITY, oil filter/ITEM, turning/ACTIVITY, counterclockwise/OBSERVATION, come free/OBSERVATION, "
"if the filter is on too tightly to remove by hand , use an oil filter wrench to loosen it first , then continue to remove it by hand .","filter/ITEM, remove/ACTIVITY, by hand/NOISE, oil filter wrench/TOOL, loosen/ACTIVITY, continue/ACTIVITY, "
place the oil filter with the open end facing down onto the oil drain pan to allow the old oil to drain out .,"place/ACTIVITY, oil filter/ITEM, open end/OBSERVATION, facing down/OBSERVATION, oil drain pan/ITEM, allow/ACTIVITY, old oil/MATERIAL, drain out/ACTIVITY, "
"dip a clean , gloved finger into a fresh bottle of oil and spread a thin layer of oil on the new oil filter 's gasket .","dip/ACTIVITY, clean/OBSERVATION, gloved finger/ITEM, fresh bottle of oil/MATERIAL, spread/ACTIVITY, thin layer/OBSERVATION, oil filter/ITEM, gasket/ITEM, "
wipe off the oil filter thread and contact area on the engine with a clean rag or towel .,"wipe off/ACTIVITY, oil filter thread/ITEM, contact area/LOCATION, engine/ITEM, clean rag/MATERIAL, towel/MATERIAL, "
place the new oil filter over the thread and turn it clockwise until it is snug .,"place/ACTIVITY, new oil filter/ITEM, over the thread/LOCATION, turn/ACTIVITY, clockwise/OBSERVATION, snug/OBSERVATION, "
twist the oil filler cap counterclockwise and remove it from the valve cover .,"twist/ACTIVITY, oil filler cap/ITEM, counterclockwise/OBSERVATION, remove/ACTIVITY, valve cover/ITEM, "
place a funnel in the oil filler hole .,"place/ACTIVITY, funnel/TOOL, oil filler hole/LOCATION, "
hold the funnel with one hand to steady it and pour 5.1 quart of 15 w-40 oil into the funnel .,"hold/ACTIVITY, funnel/ITEM, one hand/LOCATION, steady/OBSERVATION, pour/ACTIVITY, 5.1 quart/CARDINALITY, 15 w-40 oil/MATERIAL, "
reinstall the oil filler cap and turn it clockwise until it is snug .,"reinstall/ACTIVITY, oil filler cap/ITEM, turn/ACTIVITY, clockwise/OBSERVATION, snug/OBSERVATION, "
"remove the dipstick , wipe it off with a clean rag or towel , reinsert it , and remove it again .","remove/ACTIVITY, dipstick/ITEM, wipe/ACTIVITY, clean rag/MATERIAL, towel/MATERIAL, reinsert/ACTIVITY, remove/ACTIVITY, "
"reinsert the dipstick and add or remove any oil , if necessary .","reinsert the dipstick/ACTIVITY, add or remove/ACTIVITY, oil/MATERIAL, if necessary/NOISE, "
"place the engine panel back in it original location , making sure the two retaining tab go through their respective slot in the panel .","place/ACTIVITY, engine panel/ITEM, back in it original location/LOCATION, making sure/NOISE, two/CARDINALITY, retaining tab/ITEM, go through/ACTIVITY, their respective slot/LOCATION, panel/ITEM, "
"secure the engine panel by pulling the retaining tab straight out , turning them 90 , and laying them down flat .","secure/ACTIVITY, engine panel/ITEM, pulling/ACTIVITY, retaining tab/ITEM, straight out/OBSERVATION, turning/ACTIVITY, 90/OBSERVATION, laying down flat/OBSERVATION, "
hold the hood up with one hand and use the other hand to return the hood prop to it original location,"hold/ACTIVITY, hood/ITEM, hand/ITEM, use/ACTIVITY, return/ACTIVITY, hood prop/ITEM, original location/LOCATION, "
close the hood firmly and make sure that the hood latch engages .,"close/ACTIVITY, hood/ITEM, firmly/NOISE, make sure/NOISE, hood latch/ITEM, engages/OBSERVATION, "
open the rear part of the middle console .,"open/ACTIVITY, rear part/LOCATION, middle console/ITEM, "
grip the right side of the console and pull up towards the passenger seat to remove it .,"grip/ACTIVITY, right side of the console/LOCATION, pull/ACTIVITY, passenger seat/LOCATION, remove/ACTIVITY, "
locate the two bolt under the air conditioning control at the bottom of the face plate .,"locate/ACTIVITY, two/CARDINALITY, bolt/ITEM, air conditioning control/ITEM, bottom of the face plate/LOCATION, "
loosen these two bolt with a basic socket wrench suited for 7 mm bolt .,"loosen/ACTIVITY, two/CARDINALITY, bolt/ITEM, basic socket wrench/TOOL, 7 mm/ITEM, "
wedge a spudger or plastic opening tool ( in place of the screwdriver shown ) under the top of the face plate .,"wedge/ACTIVITY, spudger/TOOL, plastic opening tool/TOOL, top of the face plate/LOCATION, "
apply pressure until the corner pop out of place .,"apply pressure/ACTIVITY, corner/ITEM, pop out of place/OBSERVATION, "
inspect the interior of the center console for damaged wire or other faulty component .,"inspect/ACTIVITY, interior/LOCATION, center console/ITEM, damaged wire/ITEM, faulty component/ITEM, "
"remove 4 , 7.9 mm nut using a 7.9 mm socket driver head","remove/ACTIVITY, four/CARDINALITY, 7.9 mm nut/ITEM, 7.9 mm socket driver head/TOOL, "
one of the nut is placed underneath the l-bracket . remove the l-bracket and the 3 circled nut before attempting to remove the remaining nut,"nut/ITEM, placed underneath/OBSERVATION, l-bracket/ITEM, remove/ACTIVITY, circled nut/ITEM, attempting to remove/ACTIVITY, remaining nut/ITEM, "
pull cover off the body of the alternator,"pull/ACTIVITY, cover/ITEM, body of the alternator/LOCATION, "
"with the alternator cover removed , use a 2 phillips screwdriver to remove the two , 6 mm screw that hold the brush cover in place .","alternator cover/ITEM, remove/ACTIVITY, 2 phillips screwdriver/TOOL, remove/ACTIVITY, two/CARDINALITY, 6 mm screw/ITEM, hold/OBSERVATION, brush cover/ITEM, in place/OBSERVATION, "
remove the brush cover assembly from the alternator . you might need to insert a needle in the small hole to separate the brush from the rotor . pull it out without using much force to avoid damage .,"remove/ACTIVITY, brush cover assembly/ITEM, alternator/ITEM, insert/ACTIVITY, needle/TOOL, small hole/LOCATION, separate/ACTIVITY, brush/ITEM, rotor/ITEM, pull/ACTIVITY, avoid damage/OBSERVATION, "
avoid disconnecting wire unless otherwise specified !,"avoid disconnecting wire/ACTIVITY, "
use a 2 phillips screwdriver to remove the two 6 mm screw holding down the voltage regulator,"2 phillips screwdriver/TOOL, remove/ACTIVITY, two/CARDINALITY, 6 mm screw/ITEM, holding down the voltage regulator/LOCATION, "
"locate and unscrew the 3 , 6 mm screw holding the bridge assembly in place",
"locate the copper lead connecting the stator to the bridge assembly . there are 3 set of 2 lead on the perimeter of the bridge , making 6 lead total .","locate/ACTIVITY, copper lead/ITEM, connecting/ACTIVITY, stator/ITEM, bridge assembly/ITEM, 3 set of 2 lead/CARDINALITY, perimeter of the bridge/LOCATION, 6 lead total/CARDINALITY, "
these lead must be cut in order to remove the bridge from the alternator . these lead will have to be soldered back together on reassembly . keep the cut a clean a possible .,"cut/ACTIVITY, lead/ITEM, remove/ACTIVITY, bridge/ITEM, alternator/ITEM, soldered back together/ACTIVITY, reassembly/ACTIVITY, keep/ACTIVITY, clean/OBSERVATION, as possible/NOISE, "
use wire cutter to cut all 6 of the lead on the perimeter of the bridge .,"wire cutter/TOOL, cut/ACTIVITY, all/CARDINALITY, 6/CARDINALITY, lead/ITEM, perimeter of the bridge/LOCATION, "
"if necessary , use a pry bar to gently raise the top of the bridge assembly off the alternator","use/ACTIVITY, pry bar/TOOL, raise/ACTIVITY, top of the bridge assembly/ITEM, alternator/ITEM, "
be extremely careful with the pry bar . excessive force will damage the bridge assembly .,"be extremely careful/NOISE, pry bar/TOOL, excessive force/OBSERVATION, damage/OBSERVATION, bridge assembly/ITEM, "
make sure the cut end of the copper lead are straight to make bridge assembly easier to pull off .,"cut end/ITEM, copper lead/ITEM, straight/OBSERVATION, make/ACTIVITY, bridge assembly/ITEM, pull off/ACTIVITY, "
remove the lower section of the bridge assembly,"remove/ACTIVITY, lower section/ITEM, bridge assembly/ITEM, "
use of a pry bar may be necessary . be gentle .,"pry bar/TOOL, necessary/OBSERVATION, be gentle/NOISE, "
"use a phillips 2 screwdriver or a 7.5 mm socket driver to unscrew the 4 , 7.5 mm bolt running along the outer perimeter of the alternator","phillips 2 screwdriver/TOOL, unscrew/ACTIVITY, 7.5 mm socket driver/TOOL, 4/CARDINALITY, 7.5 mm bolt/ITEM, running along the outer perimeter of the alternator/LOCATION, "
use a c-clamp or another fixture to hold the pulley in place,"use/ACTIVITY, c-clamp/TOOL, fixture/ITEM, hold/ACTIVITY, pulley/ITEM, in place/LOCATION, "
be gentle with the clamp . excessive force will bend the pulley out of shape,"be gentle/NOISE, clamp/ITEM, excessive force/OBSERVATION, bend/ACTIVITY, pulley/ITEM, out of shape/OBSERVATION, "
use a ratchet with a 25 mm socket to remove the 25 mm hex nut from the pulley,"ratchet/TOOL, 25 mm socket/TOOL, remove/ACTIVITY, 25 mm hex nut/ITEM, pulley/ITEM, "
"once the nut is off , you can then remove the pulley .","nut/ITEM, remove/ACTIVITY, pulley/ITEM, "
"once the pulley is removed , separate the rotor and stator . the stator is the piece with copper winding .","remove/ACTIVITY, pulley/ITEM, separate/ACTIVITY, rotor/ITEM, stator/ITEM, copper winding/OBSERVATION, "
you can pull the stator out of the remaining cover and examine it .,"pull/ACTIVITY, stator/ITEM, out of the remaining cover/LOCATION, examine/ACTIVITY, "
"if the stator is scratched or damaged , you will need to replace it . look for scoring mark or cut piece of winding .","stator/ITEM, scratched/OBSERVATION, damaged/OBSERVATION, replace/ACTIVITY, look for/ACTIVITY, scoring mark/OBSERVATION, cut piece of winding/OBSERVATION, "
